{
  "schema_version": "1.0.0",
  "kind": "gaps",
  "title": "Product RE coverage gaps (fixture)",
  "summary": "Sample coverage gaps across ingest and transform outputs.",
  "gaps": [
    {
      "id": "gap-savings-funding-routes",
      "severity": "medium",
      "statement": "Savings-account-to-jar funding routes are mentioned but not fully inventoried in artifacts/features/.",
      "sources": [
        "artifacts/features/",
        "artifacts/product-architecture/"
      ]
    }
  ],
  "sources": [
    {
      "path": "artifacts/features/"
    },
    {
      "path": "artifacts/product/"
    }
  ],
  "created_at": "2026-08-01T14:00:00Z",
  "extensions": {
    "fixture": true,
    "pipeline": "product-re",
    "runtime_shape": "entries[]"
  }
}
